{
  "meta": {
    "runId": "run-2026-01-21-19-07-09",
    "baseSha": "<redacted>",
    "schemaVersion": "1.0.0",
    "thresholds": {
      "ok": 0.8,
      "warn": 0.65
    },
    "provenance": {
      "promptId": "reasoner.v1",
      "model": "gpt-5.1",
      "generatedAt": "2026-01-21T19:34:47.789Z"
    },
    "telemetry": {
      "latencyMs": 797485.3291580009,
      "tokens": {
        "prompt": 182419,
        "completion": 42000,
        "total": 224419
      },
      "retries": 0
    }
  },
  "facts": [
    {
      "jsonPath": "$.business.executiveSummary",
      "jsonPointer": "/business/executiveSummary",
      "proposedValue": "This repository implements a scalable Bayesian hierarchical model for daily store-level sales forecasting, accompanying the blog post \"Finally! Bayesian Hierarchical Modelling at Scale\". It uses JAX and NumPyro to fit a Gamma-Poisson model that pools information across many retail stores while retaining store-specific effects. Data is downloaded from the Rossmann store sales Kaggle dataset, preprocessed into a feature cube, and trained using stochastic variational inference. The notebooks demonstrate end-to-end preprocessing, model fitting, posterior analysis, and comparison against a conventional linear regression baseline. The project is intended as reproducible, research-grade code rather than a production deployment.",
      "source": {
        "kind": "inferred"
      },
      "repoSources": [
        {
          "path": "README.md",
          "startLine": 1,
          "endLine": 20,
          "commit": "<redacted>",
          "kind": "docs"
        },
        {
          "path": "notebooks/02-model.ipynb",
          "startLine": 1,
          "endLine": 200,
          "commit": "<redacted>",
          "kind": "code"
        },
        {
          "path": "notebooks/03-evaluation.ipynb",
          "startLine": 1,
          "endLine": 200,
          "commit": "<redacted>",
          "kind": "code"
        }
      ],
      "confidence": 0.2,
      "gate": "OK"
    },
    {
      "jsonPath": "$.business.hazardousUseCases",
      "jsonPointer": "/business/hazardousUseCases",
      "proposedValue": [
        "Using the model’s forecasts directly for safety-critical or legally regulated decisions (e.g., healthcare, credit, or public safety) without additional domain validation and governance.",
        "Applying the example code to sensitive or personal data sets without adding appropriate privacy, security, and compliance controls."
      ],
      "source": {
        "kind": "inferred"
      },
      "repoSources": [
        {
          "path": "LICENSE.txt",
          "startLine": 1,
          "endLine": 40,
          "commit": "<redacted>",
          "kind": "code"
        },
        {
          "path": "README.md",
          "startLine": 1,
          "endLine": 40,
          "commit": "<redacted>",
          "kind": "docs"
        }
      ],
      "confidence": 0.1,
      "gate": "Require",
      "verifierNotes": "Neither the LICENSE excerpt nor the README snippet includes any warnings or statements about hazardous or safety‑critical use, sensitive data, or compliance/privacy constraints. The proposed hazardous use cases are not grounded in the provided text."
    },
    {
      "jsonPath": "$.business.intendedUse",
      "jsonPointer": "/business/intendedUse",
      "proposedValue": "The intended use of this repository is to serve as a reproducible, educational example of Bayesian hierarchical modelling at scale, showing how to implement a Gamma-Poisson sales forecasting model with JAX/NumPyro on the Rossmann store sales dataset. It is meant for experimentation in notebooks, methodological exploration, and as a template for adapting similar probabilistic models to other tabular time-series problems.",
      "source": {
        "kind": "inferred"
      },
      "repoSources": [
        {
          "path": "README.md",
          "startLine": 1,
          "endLine": 25,
          "commit": "<redacted>",
          "kind": "docs"
        },
        {
          "path": "notebooks/02-model.ipynb",
          "startLine": 1,
          "endLine": 120,
          "commit": "<redacted>",
          "kind": "code"
        }
      ],
      "confidence": 0.2,
      "gate": "OK"
    },
    {
      "jsonPath": "$.business.nonGoals",
      "jsonPointer": "/business/nonGoals",
      "proposedValue": [
        "Providing a production-ready forecasting service or managed API; the code is organised as notebooks and a research-focused Python package rather than a deployed application.",
        "Building a generic, fully parameterised forecasting library; the implementation is tailored to the Rossmann store sales example used in the accompanying blog post."
      ],
      "source": {
        "kind": "inferred"
      },
      "repoSources": [
        {
          "path": "README.md",
          "startLine": 1,
          "endLine": 40,
          "commit": "<redacted>",
          "kind": "docs"
        },
        {
          "path": "src/bhm_at_scale/__init__.py",
          "startLine": 1,
          "endLine": 20,
          "commit": "<redacted>",
          "kind": "code"
        }
      ],
      "confidence": 0.2,
      "gate": "Warn"
    },
    {
      "jsonPath": "$.business.outOfScopeUse",
      "jsonPointer": "/business/outOfScopeUse",
      "proposedValue": [
        "Real-time, low-latency prediction serving; the project is designed around offline batch inference in notebooks and file-based I/O.",
        "Turnkey support for arbitrary datasets; adapting the code to new domains requires manual preprocessing and model adjustments."
      ],
      "source": {
        "kind": "inferred"
      },
      "repoSources": [
        {
          "path": "README.md",
          "startLine": 20,
          "endLine": 80,
          "commit": "<redacted>",
          "kind": "docs"
        },
        {
          "path": "notebooks/01-preprocessing.ipynb",
          "startLine": 1,
          "endLine": 160,
          "commit": "<redacted>",
          "kind": "code"
        }
      ],
      "confidence": 0.2,
      "gate": "Warn"
    },
    {
      "jsonPath": "$.business.useCase",
      "jsonPointer": "/business/useCase",
      "proposedValue": "Forecasting daily sales for many retail stores using a Bayesian hierarchical Gamma-Poisson model that shares statistical strength across stores while capturing store-specific effects, demonstrated on the Rossmann store sales Kaggle dataset.",
      "source": {
        "kind": "inferred"
      },
      "repoSources": [
        {
          "path": "README.md",
          "startLine": 1,
          "endLine": 15,
          "commit": "<redacted>",
          "kind": "docs"
        },
        {
          "path": "notebooks/01-preprocessing.ipynb",
          "startLine": 40,
          "endLine": 140,
          "commit": "<redacted>",
          "kind": "code"
        },
        {
          "path": "src/bhm_at_scale/model.py",
          "startLine": 65,
          "endLine": 110,
          "commit": "<redacted>",
          "kind": "code"
        }
      ],
      "confidence": 0.9,
      "gate": "OK"
    },
    {
      "jsonPath": "$.business.userPopulations",
      "jsonPointer": "/business/userPopulations",
      "currentValue": [],
      "proposedValue": [
        "Data scientists and statisticians interested in Bayesian hierarchical models for time-series and count data.",
        "Machine learning researchers and engineers experimenting with scalable probabilistic programming using JAX and NumPyro."
      ],
      "source": {
        "kind": "inferred"
      },
      "repoSources": [
        {
          "path": "README.md",
          "startLine": 1,
          "endLine": 30,
          "commit": "<redacted>",
          "kind": "docs"
        },
        {
          "path": "environment.yaml",
          "startLine": 1,
          "endLine": 40,
          "commit": "<redacted>",
          "kind": "config"
        }
      ],
      "confidence": 0.2,
      "gate": "OK"
    },
    {
      "jsonPath": "$.devInsight.architecture.dataFlow",
      "jsonPointer": "/devInsight/architecture/dataFlow",
      "proposedValue": [
        "Download Rossmann store sales data (train.csv and store.csv) from Kaggle into data/raw using kaggle.api.dataset_download_files in notebooks/01-preprocessing.ipynb.",
        "Clean and feature-engineer the joined sales and store tables with pandas (handling holidays, assortment, store type, and time indices) and write the intermediate DataFrame df and encoded edf.csv to data/preprocessed and data/result.",
        "Dummy-encode categorical variables (e.g., DayOfWeek, StateHoliday, StoreVariant) and reshape the data into a StoreId × Timestep × (features + target) cube via bhm_at_scale.preprocess.make_cube, saving X_train.npz and X_test.npz.",
        "Load X_train in notebooks/02-model.ipynb, initialise the Gamma-Poisson hierarchical model and guide from bhm_at_scale.model, and train parameters with ModelHandler.fit using NumPyro’s SVI and an Adam optimizer.",
        "Use ModelHandler.predict and predictive_model to generate posterior predictive sales trajectories for train and test stores, save summary CSVs (e.g., train_preds.csv, test_preds.csv, stats.csv) under data/result, and visualise store-level histories and global weekday/promotion effects in notebooks/03-evaluation.ipynb via PlotStore and plot_densities."
      ],
      "source": {
        "kind": "inferred"
      },
      "repoSources": [
        {
          "path": "notebooks/01-preprocessing.ipynb",
          "startLine": 1,
          "endLine": 200,
          "commit": "<redacted>",
          "kind": "code"
        },
        {
          "path": "notebooks/02-model.ipynb",
          "startLine": 1,
          "endLine": 260,
          "commit": "<redacted>",
          "kind": "code"
        },
        {
          "path": "notebooks/03-evaluation.ipynb",
          "startLine": 1,